{
  "$schema": "https://json-schema.org/draft/2020-12/schema",
  "$id": "https://narratoria.dev/schemas/plan-json.schema.json",
  "title": "Plan JSON",
  "description": "Structured plan generated by narrator AI for tool execution",
  "type": "object",
  "required": ["requestId", "tools"],
  "properties": {
    "requestId": {
      "type": "string",
      "format": "uuid",
      "description": "Unique identifier for this plan execution"
    },
    "narrative": {
      "type": "string",
      "description": "Optional narrative text to display before or during tool execution"
    },
    "tools": {
      "type": "array",
      "description": "Array of tool invocation descriptors",
      "items": {
        "$ref": "#/$defs/ToolInvocation"
      }
    },
    "parallel": {
      "type": "boolean",
      "default": false,
      "description": "If true and dependencies allow, tools run concurrently"
    },
    "disabledSkills": {
      "type": "array",
      "items": {
        "type": "string"
      },
      "default": [],
      "description": "Skills that failed in previous attempts; planner MUST NOT select these"
    },
    "metadata": {
      "$ref": "#/$defs/PlanMetadata"
    }
  },
  "$defs": {
    "ToolInvocation": {
      "type": "object",
      "required": ["toolId", "toolPath"],
      "properties": {
        "toolId": {
          "type": "string",
          "description": "Unique ID for this tool within the plan (for dependency tracking)"
        },
        "toolPath": {
          "type": "string",
          "description": "Absolute or relative path to the tool executable"
        },
        "input": {
          "type": "object",
          "additionalProperties": true,
          "description": "JSON object passed to the tool via stdin"
        },
        "dependencies": {
          "type": "array",
          "items": {
            "type": "string"
          },
          "default": [],
          "description": "Array of toolId values that must complete before this tool runs"
        },
        "required": {
          "type": "boolean",
          "default": true,
          "description": "If true, tool failure aborts dependent tools; if false, failure is non-blocking"
        },
        "async": {
          "type": "boolean",
          "default": false,
          "description": "If true, tool may run in parallel with unrelated tools"
        },
        "retryPolicy": {
          "$ref": "#/$defs/RetryPolicy"
        }
      }
    },
    "RetryPolicy": {
      "type": "object",
      "description": "Configures retry behavior for tool execution",
      "properties": {
        "maxRetries": {
          "type": "integer",
          "default": 3,
          "minimum": 0,
          "maximum": 10,
          "description": "Maximum retry attempts before marking tool as failed"
        },
        "backoffMs": {
          "type": "integer",
          "default": 100,
          "minimum": 0,
          "description": "Base milliseconds between retries (exponential backoff: delay = backoffMs Ã— 2^(attempt-1))"
        }
      }
    },
    "PlanMetadata": {
      "type": "object",
      "description": "Plan metadata for debugging and replan tracking",
      "properties": {
        "generationAttempt": {
          "type": "integer",
          "minimum": 1,
          "description": "Which attempt this plan represents (1, 2, 3...)"
        },
        "parentPlanId": {
          "type": ["string", "null"],
          "format": "uuid",
          "description": "If this is a replan, the UUID of the previous plan that failed"
        }
      }
    }
  }
}
