{
  "requestId": "550e8400-e29b-41d4-a716-446655440000",
  "narrative": "You reach for the torch on the wall and examine the mysterious door ahead.",
  "tools": [
    {
      "toolId": "light1",
      "toolPath": "./tools/torch-lighter",
      "input": {
        "action": "light_torch"
      },
      "dependencies": [],
      "required": true,
      "async": false,
      "retryPolicy": {
        "maxRetries": 3,
        "backoffMs": 100
      }
    },
    {
      "toolId": "examine1",
      "toolPath": "./tools/door-examiner",
      "input": {
        "target": "mysterious_door"
      },
      "dependencies": ["light1"],
      "required": true,
      "async": false,
      "retryPolicy": {
        "maxRetries": 3,
        "backoffMs": 100
      }
    }
  ],
  "parallel": false,
  "disabledSkills": [],
  "metadata": {
    "generationAttempt": 1,
    "parentPlanId": null
  }
}
